section_number,title,description,chapter,chapter_title,keywords,text_length
135,Exemption from arrest under civil process,"(1) No Judge, Magistrate or other judicial officer shall be liable to arrest under civil process while going to, presiding in, or returning from, his Court. (2) Where any matter is pending before a tribunal having jurisdiction therein, or believing in good faith that it has such jurisdiction, the parties thereto, their pleaders, mukhtars, revenue-agents and recognized agents, and their witnesses acting in obedience to a summons, shall be exempt from arrest under civil process other than process ...",11,Appearance of Parties and Consequences of Non-appearance,"judgment, judge, jurisdiction, parties, summons, process, civil, exemption, order, execution",910
135A.,Exemption of members of legislative bodies from arrest and detention under civil process,"1[135A. Exemption of members of legislative bodies from arrest and detention under civil process-- 2[(1) No person shall be liable to arrest or detention in prison under civil process-- (a) if he is a member of-- (i) either House of Parliament, or (ii) the Legislative Assembly or Legislative Council of a State, or (iii) a Legislative Assembly of a Union territory, during the continuance of any meeting of such House of Parliament or, as the case may be, of the Legislative Assembly or the Legislat...",11,Appearance of Parties and Consequences of Non-appearance,"parliament, detention, legislative council, legislative, exemption, bodies, civil, process, legislative assembly, members",1426
136,Procedure where person to be arrested or property to be attached is out side district,"(1) Where an application is made that any person shall be arrested or that any property shall be attached under any provision of this Code not relating to the execution of decrees, and such person resides or such property is situate outside the local limits of the jurisdiction of the Court to which the application is made, the Court may, in its discretion, issue, a warrant of arrest of make an order of attachment, and send to the District Court within the local limits of whose jurisdiction such ...",12,Admission and Denial,"property, side, jurisdiction, district court, application, arrested, execution, order, person, court",1964
137,Language of subordinate Courts,"(1) The language which, on the commencement of this Code, is the language of any Court subordinate to a High Court shall continue to be the language of such subordinate Court until the State Government otherwise directs. (2) The State Government may declare what shall be the language of any such Court and in what character applications to and proceedings in such Courts shall be written. (3) Where this Court requires or allows anything other that the recording of evidence to be done in writing in...",12,Admission and Denial,"language, courts, state government, pleader, order, evidence, court, subordinate, high court",810
138,Power of High Court to require evidence to be recorded in English,"1[138. Power of High Court to require evidence to be recorded in English.-- (1) The 2[High Court] may, by notification in the Official Gazette, direct with respect to any Judge specified in the notification, or falling under a description set forth therein, that evidence in cases in which an appeal is allowed shall be taken down by him in the English language and in manner prescribed. (2) Where a Judge is prevented by any sufficient reason from complying with a direction under sub-section (1), h...",12,Admission and Denial,"judge, recorded, require, high, official gazette, court, high court, appeal, english, evidence",610
139,Oath on affidavit by whom to be administered,"In the case of any affidavit under this Code- (a) any Court or Magistrate, or 1[(aa) any notary appointed under the Notaries Act, 1952 (53 of 1952); or] (b) any officer or other person whom a High Court may appoint in this behalf, or (c) any officer appointed by any other Court which the State Government has generally or specially empowered in this behalf, may administer the oath to the deponent.",12,Admission and Denial,"whom, oath, magistrate, notaries act, administered, court, high court, affidavit",399
140,"Assessors in causes of salvage, etc","(1) In any admiralty or vice-admiralty cause of salvage to wage or collision the Court, whether it be exercising its original or its appellate jurisdiction, may, if it thinks fit, and shall upon request of either party to such cause, summon to its assistance, in such manner as it may direct or as may be prescribed, two competent assessors; and such assessors shall attend and assist accordingly. (2) Every such assessor shall receive such fees for his attendance, to be paid by such of the parties ...",12,Admission and Denial,"causes, jurisdiction, every, parties, salvage, court, assessors",548
141,Miscellaneous proceedings,"The procedure provided in this Code in regard to suits shall be followed, as far as it can be made applicable, in all proceedings in any Court of civil jurisdiction. 1[Explanation.- In this section, the expression ""proceedings"" includes proceedings under Order IX, but does not include anyproceedings under article 226 of the Constitution.]",12,Admission and Denial,"miscellaneous, proceedings, jurisdiction, explanation, order, court, constitution, procedure",340
142,Orders and notices to be in writing,All orders and notices served on or given to any person under the provisions of this Code shall be in writing.,12,Admission and Denial,"writing, orders, notices",110
143,Postage,"Postage, where chargeable on a notice, summons or letter issued under this Code and forwarded by post, and the fee for registering the same, shall be paid within a time to be fixed before the communication is made: Provided that the State Government 1  may remit such postage, or fee, or both, or may prescribe a scale of court-fees to be levied in lieu thereof.",12,Admission and Denial,"state government, provided, summons, court, postage",362
144,Application for restitution,"(1)Where and in so far as a decree 1 [or an order] is 2 [varied or reversed in any appeal, revision or other proceeding or is set aside or modified in any suit instituted for the purpose, the Court which passed the decree or order] shall, on the application of any party entitled to any benefit by way of restitution or otherwise, cause such restitution to be made as will, so far as may be, place the parties in the position which they would have occupied but for such decree 1 [or order] or 3 [such...",12,Admission and Denial,"suit, jurisdiction, parties, passed, damages, application, explanation, restitution, order, court",1727
145,Enforcement of liability of surety,"Where any person 1 [has furnished security or given a guarantee]-- (a) for the performance of any decree or any part thereof, or (b) for the restitution of any property taken in execution of a decree, or (c) for the payment of any money, or for the fulfilment of any condition imposed on any person, under an order of the Court in any suit or in any proceeding consequent thereon, 2 [the decree or order may be executed in the manner therein provided for the execution of decrees, namely:-- (i) if he...",12,Admission and Denial,"suit, property, liability, provided, order, execution, surety, court, decree, enforcement",960
146,Proceedings by or against representatives,"Save as otherwise provided by this Code or by any law for the time being in force, where any proceeding may be taken or application made by or against any person then the proceeding may be taken or the application may be made by or against any person claiming under him.",12,Admission and Denial,"proceedings, against, representatives, application, save",270
147,Consent or agreement by persons under disability,"In all suits to which any person under disability is a party, any consent or agreement, as to any proceeding shall, if given or made with the express leave of the Court by the next friend or guardian for the suit, have the same force and effect as if such person, were under no disability and had given such consent or made such agreement.",12,Admission and Denial,"consent, agreement, suit, persons, disability, court",339
148,Enlargement of time,"Where any period is fixed or granted by the Court for the doing of any act prescribed or allowed by this Code, the Court may, in its discretion, from time to time, enlarge such period, 1 [not exceeding thirty days in total,] even though the period originally fixed or granted may have expired.",12,Admission and Denial,"enlargement, court",293
148A.,Right to lodge a caveat,"1[148 A. Right to lodge a caveat.-- (1)Where an application is expected to be made, or has been made, in a suit or proceeding instituted, or about to be instituted, in a Court , any person claiming a right to appear before the Court on the hearing of such application may lodge a caveat in respect thereof. (2) Where a caveat has been lodged under sub-section (1), the person by whom the caveat has been lodged (hereinafter referred to as the caveator) shall serve a notice of the caveat by registere...",12,Admission and Denial,"suit, caveat, application, hearing, court, right, lodge",1377
149,Power to make up deficiency of court-fees,"Where the whole or any part of any fee prescribed for any document by the law for the time being in force relating to court-fees has not been paid, the Court may, in its discretion, at any stage, allow the person, by whom such fee is payable, to pay the whole or part, as the case may be, of such court-fee; and upon such payment the document, in respect of which fee is payable, shall have the same force and effect as if such fee had been paid in the first instance.",13,"Production, Impounding and Return of Documents","make, fees, deficiency, court, power",468
150,Transfer of business,"Save as otherwise provided, where the business of any Court is transferred to any other Court, the Court to which the business is so transferred shall have the same powers and shall perform the same duties as those respectively conferred and imposed by or under this Code upon the Court from which the business was so transferred.",13,"Production, Impounding and Return of Documents","business, save, court, transfer",330
151,Saving of inherent powers of Court,Nothing in this Code shall be deemed to limit or otherwise affect the inherent power of the Court to make such orders as may be necessary for the ends of justice or to prevent abuse of the process of the Court.,13,"Production, Impounding and Return of Documents","powers, nothing, saving, court, inherent",210
152,"Amendment of judgments, decrees or orders","Clerical or arithmetical mistakes in judgments, decrees or orders or errors arising therein from any accidental slip or omission may at any time be corrected by the Court either of its own motion or on the application of any of the parties.",13,"Production, Impounding and Return of Documents","parties, orders, decrees, application, clerical, court, amendment, judgments",240
153,General power to amend,"The Court may at any time, and on such terms as to costs or otherwise as it may think fit, amend any defect or error in any proceeding in a suit ; and all necessary amendments shall be made for the purpose of determining the real question or issue raised by or depending on such proceeding.",13,"Production, Impounding and Return of Documents","amend, suit, general, court, power",290
153A.,Power to amend decree or order where appeal is summarily dismissed,"1[153A. Power to amend decree or order where appeal is summarily dismissed.-- Where an Appellate Court dismisses an appeal under rule 11 of Order XLI, the power of the Court to amend, under section 152, the decree or order appealed against may be exercised by the Court which had passed the decree or order in the first, instance, notwithstanding that the dismissal of the appeal has the effect of confirming the decree or order, as the case may be, passed by the Court of first instance.",13,"Production, Impounding and Return of Documents","amend, order, appeal, dismissed, court, decree, summarily, appellate court, power",488
153B.,Place of trial to be deemed to be open Court,"The place in which any Civil Court is held for the purpose of trying any suit shall be deemed to be an open Court, to which the public generally may have access so far as the same can conveniently contain them: Provided that the presiding Judge may, if he thinks fit, order at any stage of any inquiry into or trial of any particular case, that the public generally, or any particular person, shall not have access to, or be or remain in, the room or building used by the Court.]",13,"Production, Impounding and Return of Documents","suit, place, civil court, judge, provided, order, trial, court, deemed, open",479
154,[Repealed],"[Saving of present right of appeal.] Rep. by the Repealing and Amending Act, 1952 (48 of 1952), s. 2 and the First Schedule.",14,Settlement of Issues and Determination of Suit on Issues of Law or on Issues Agreed Upon,"first schedule, saving, appeal, amending act, repealed, repealing",124
155,[Repealed],"[Amendment of certain Acts.] Rep. by s. 2 and the First Schedule, ibid.",14,Settlement of Issues and Determination of Suit on Issues of Law or on Issues Agreed Upon,"first schedule, repealed, amendment, acts",71
156,[Repealed],"[Repeals.] Rep. by the Second Repealing and Amending Act, 1914 (17 of1914). s. 3 and the Second Schedule.",14,Settlement of Issues and Determination of Suit on Issues of Law or on Issues Agreed Upon,"repeals, second repealing, second schedule, amending act, repealed",105
157,Continuance of orders under repealed enactments,"Notifications published, declarations and rules made, places appointed, agreements filed, scales prescribed, forms framed, appointments made and powers conferred under Act VIII of 1859 or under any Code of Civil Procedure or any Act amending the same or under any other enactment hereby repealed shall, so far as they are consistent with this Code, have the same force and effect as if they had been respectively published, made, appointed, filed, prescribed, framed and conferred under this Code and...",14,Settlement of Issues and Determination of Suit on Issues of Law or on Issues Agreed Upon,"continuance, civil procedure, notifications, enactments, orders, procedure, repealed",551
158,Reference to Code of Civil Procedure and other repealed enactments,"In every enactment or notification passed or issued before the commencement of this Code in which reference is made to or to any Chapter or section of Act VIII of 1859 or any Code of Civil Procedure or any Act amending the same or any other enactment hereby repealed, such reference shall, so far as may be practicable, ben to be made to this Code or to its corresponding Part, Order, section or rule.",14,Settlement of Issues and Determination of Suit on Issues of Law or on Issues Agreed Upon,"civil procedure, enactments, civil, order, procedure, repealed, reference",401
